{
  "investorId": "9876543210",
  "creationReason": "Transferred",
  "accountId": "1234567891",
  "firstSubscriptionDate": "2017-04-06",
  "accountStatus": "OPEN",
  "subscriptionStatus": "AVAILABLE",
  "transferAccount": {
    "transferredFromAccountId": "8765432100",
    "transferredFromLMRN": "Z654321",
    "transferInDate": "2017-04-06"
  }
}